ID,Parent Id,Name,Has Page Title,Has Meta Description,Has Content,Is Visible,No. Of Products,Page Title,Page Title Length,Meta Description,Meta Description Length,URL,Meta Keywords,Search Keywords
1367,1034,"High Chairs, Booster Seats & Bouncers",TRUE,TRUE,FALSE,TRUE,30,"High Chairs, Booster Seats & Bouncers: Keeping Baby Safe",56,"Our extensive range of high chairs, booster seats & bouncers are perfect for around the house or on the go. Order by 2pm for next day delivery in Ireland!",154,/high-chairs-booster-seats-bouncers/,High Chairs  Booster Seats & Bouncers,"High Chairs, Booster Seats & Bouncers"
1369,1031,Cupboard & Drawer Locks,TRUE,TRUE,FALSE,TRUE,13,Baby Cupboard Locks : Buy Baby Drawer Locks in Ireland,54,Prevent unnecessary accidents in the home with our extensive range of certified baby cupboard locks and baby drawer locks. Next day delivery in Ireland,151,/cupboard-drawer-locks/,Cupboard & Drawer Locks,Cupboard & Drawer Locks
1382,1047,Breastfeeding Pillow & Accessories,TRUE,TRUE,FALSE,TRUE,11,Breastfeeding Pillows: Best Nursing Pillows For Breastfeeding,61,Feed your little one with comfort & ease with our selection of breastfeeding pillows & find the best pillow for you & your baby. Order now for next day delivery,160,/breastfeeding-pillow-accessories/,Breastfeeding Pillow & Accessories,Breastfeeding Pillow & Accessories
1383,971,Drug Tests,TRUE,TRUE,FALSE,TRUE,4,Drug Tests: Get Results In The Privacy Of Your Own Home,55,Our self-check drug tests give you accurate results from the privacy of your own home for all kinds of substances. Shop today & get next day delivery in Ireland.,161,/drug-tests/,Drug Tests,Drug Tests
1385,1023,Labour Essentials,TRUE,TRUE,FALSE,TRUE,23,Labour Essentials: Essentials For Hospital Bags For Labour,58,Ensure that you are prepared & equipped with our Labour Essentials & all you need for your hospital bag for when you go in to labour. Get same day dispatch on orders placed before 2pm from our Irish-based warehouse. Order now!,226,/labour-essentials/,Labour Essentials ,Labour Essentials 
1391,1034,Travel & Outdoor,TRUE,TRUE,FALSE,TRUE,85,Baby Travel : Shop Baby On The Go & Outdoor Baby Products,57,Shop our extensive range of baby travel and outdoor baby products. Place your order today and get next day delivery direct from our warehouse in Ireland,152,/travel-outdoor/,Travel & Outdoor,Travel & Outdoor
1393,1042,Pregnancy & Baby SALE Event,TRUE,TRUE,FALSE,TRUE,143,Pregnancy & Baby Fair Offers | inhealth.ie,42,Shop Our Pregnancy & Baby Fair Offers Products Now! Best Price and Next Day Delivery Ireland. Order Online Today!,113,/pregnancy-baby-sale-event/,Pregnancy & Baby SALE Event,Pregnancy & Baby SALE Event
1394,1034,"Bathing, Changing & Toilet Training",TRUE,TRUE,FALSE,TRUE,76,"Baby Baths & Accessories, Changing Mats & Baby Potties",54,"Browse our range of baby bathing & changing accessories. We stock a choice of baby baths & accessories, changing mats & potties. Order now for next day delivery",160,/baby-bathing-changing-time/,Bathing & Changing Time,Bathing & Changing Time
1399,1023,Maternity Underwear,TRUE,TRUE,FALSE,TRUE,23,Buy Maternity Bras & Underwear Online In Ireland,48,Buy maternity bras & underwear online from Inhealth & enjoy same day dispatch from our Irish-based warehouse via An Post Track & Trace on orders placed before 2pm. Order now!,174,/maternity-underwear/,Maternity Underwear,Maternity Underwear
1405,975,Screw Fitting - No Trip,TRUE,TRUE,FALSE,TRUE,24,Buy Stair Gate Screws: Shop Stair Gates that use Screws,55,Screw fit stair gates are secured in place by attaching to the wall with screws. The benefit of screw fit stair gates is that they are extremely secure. The negative is that they require drilling and screws,206,/screw-fitting-no-trip/,,
1407,971,Tens Machines,TRUE,TRUE,FALSE,TRUE,6,Tens Machines ,14,Shop Our Tens Machines Products Now! Best Price and Next Day Delivery Ireland. Order Online Today!,98,/tens-machines-1/,Tens Machines ,Tens Machines 
1408,971,First Aid,TRUE,TRUE,FALSE,TRUE,2,First Aid | inhealth.ie,23,Shop Our First Aid Products Now! Best Price and Next Day Delivery Ireland. Order Online Today!,94,/first-aid/,First Aid,First Aid
1409,1023,Post-Pregnancy Supports,TRUE,TRUE,FALSE,TRUE,31,Post-Pregnancy Supports: Pregnancy Support Belts & Leggings,59,Inhealth offers a range of post-pregnancy supports for your comfort including pregnancy support belts & leggings. Order yours today & enjoy same day dispatch on orders placed before 2pm. Order now!,197,/post-pregnancy-supports/,Post Pregnancy Supports,Post Pregnancy Supports
1420,1059,Baby Mattresses & Pillows,TRUE,FALSE,TRUE,FALSE,0,Baby Mattresses & Pillows,25,,0,/baby-mattresses-pillows/,,
1422,971,Pulse Oximeters & Thermometers,TRUE,TRUE,FALSE,TRUE,17,Pulse Oximeter : Oxygen Saturation Monitor and Spo2 Monitor,59,"Inhealth stock an extensive range of certified pulse oximeter, oxygen saturation monitor and Spo2 monitors products. Buy now & get next day delivery in Ireland",159,/pulse-oximeters-thermometers/,pulse oximeter  oxygen saturation monitor and Spo2 monitors,"pulse oximeter, oxygen saturation monitor, Spo2 monitors"
1439,1391,"Kids Swimwear, UV Tent",TRUE,TRUE,FALSE,TRUE,13,Kids Swimwear & UV Tents Shipped Direct from Ireland,52,Shop our range of kids swimwear and uv tents online at inhealth.ie. Get next day tracked delivery with An Post when ordered before 2pm. Order yours today!,154,/kids-swimwear/,,
1441,975,Wooden Stair Gates,TRUE,TRUE,FALSE,TRUE,12,Wooden Stair Gates : Buy Wooden Baby Stair Gates Online,55,"Shop Our Range of Wooden Stair Gate Online at inhealth.ie, We stock a large range of wooden stairgate by leading Baby Safety brands including BabyDan and Safetots. Next Day Delivery in Ireland on all Baby Proofing Products",222,/wooden-stair-gates/,,
1442,1031,Living Room Safety,TRUE,TRUE,FALSE,TRUE,34,Living Room Safety Baby Product,31,Shop our range of living room safety baby product online at inhealth. Order today and get next day delivery in Ireland,118,/living-room-safety-1/,,
1443,975,Gates for Awkward Angles,TRUE,TRUE,FALSE,TRUE,7,Baby Gate for Awkward Angles : Gates for Difficult Spaces,57,As Ireland's leading supplier of Stair Gates we have created a dedicated category for stair gates that can fit difficult spaces and adjust to accommodate awkward angles. Next Day Delivery on all Irish orders.,208,/gates-for-awkward-angles/,,
1444,1031,Banister & Driveway Safety,TRUE,TRUE,FALSE,TRUE,2,Banister Safety : Prevent Serious Accidents on Balconies,56,Keep your child safe with a balcony or banister guard. Falls from balconies or banister are potentially lethal therefore it is critical that any potential danger on a balcony or banister are dealt with immediately. Next Day Delivery on Ireland Orders!,251,/banister-driveway-safety/,,
1445,975,Extra Tall Stair Gates,TRUE,TRUE,FALSE,TRUE,7,Extra Tall Baby Gate : Shop Our Range of Tall Stair Gates,57,Demand for Extra Tall Baby Gates has increased as parent seek to contain large pets and toddlers away from each other and other dangers in the home. Our Extra Tall Baby Gates come as Pressure & Screw Fit Gates. Next Day Delivery on Irish Orders,244,/extra-tall-stair-gates/,,
1449,1391,Car Accessories,TRUE,TRUE,FALSE,TRUE,18,Baby Car Accessories Perfect for Car Journey with Kids,54,Shop our range of must-haves baby car accessories to keep your kids safe  & comfortable during car journeys. Order your today & get next day delivery,149,/car-accessories/,,
1450,1391,"Baby Carriers, Reins & Harness",TRUE,TRUE,FALSE,TRUE,19,Barriers Carriers & Baby Harness Shipped From Ireland,53,Buy baby carrier and baby harness products online at inhealth.ie and enjoy next day tracked delivery in Ireland when you order before 2pm. Buy yours today!,155,/baby-carriers-reins-harness/,,
1451,1391,Buggy & Pram Accessories,TRUE,TRUE,FALSE,TRUE,26,Buggy Accessories & Pram Accessories for Busy Mums,50,Buggy accessories & pram accessories are a great way for busy mums to free up their hands when out & about. Shop our great range of accessories today!,150,/buggy-pram-accessories/,,
1452,1391,Travel Cots & Blackout Blinds,TRUE,TRUE,FALSE,TRUE,4,Travel Cot & Black Out Blind Product from Ireland,49,Buy Travel Cot & Black Out Blind Products online from Inhealth.ie Order before 2pm and get next day tracked delivery from Ireland. Place your order today!,154,/travel-cots-blackout-blinds/,,
1454,1391,Changing Bags,TRUE,TRUE,FALSE,TRUE,5,Baby Changing Bags & Baby Products for Mums on the Go,53,Shop our range of baby changing bags online from Inhealth.ie. Get next day fully tracked delivery via An Post when ordered before 2pm. Order yours today!,153,/changing-bags/,,"nappy bags, baby changing bags"
1455,1299,Healthcare,TRUE,TRUE,FALSE,TRUE,41,Shop The Best Baby Health Care Product From Ireland,51,Buy the best baby health care products online from Inhealth.ie. Enjoy next day fully tracked delivery with An Post when ordered before 2pm. Orders yours today!,159,/healthcare/,,
1456,1299,Moisturisers & Creams,TRUE,TRUE,FALSE,TRUE,17,Shop Baby Cream & Baby Moisturisers at Inhealth.ie,50,Inhealth stocks an extensive range of baby cream and baby moisturisers brands. Order before 2pm and get next day delivery with An Post. Order your today!,153,/moisturisers-creams/,,
1457,1299,Teething & Soothers,TRUE,TRUE,FALSE,TRUE,21,Buy Teeting Products and Soothers Online from Ireland,53,Shop our extensive range of teeting products and baby soothers. Get next day tracked delivery in Ireland with An Post when you order before 2pm. Shop now!,154,/teething-soothers/,,
1459,1409,Belly Wraps,TRUE,TRUE,FALSE,TRUE,19,Belly Wraps : Shop Postpartum Belly Band Products,49,Postpartum belly bands & belly wraps are a great aid to recovery post pregnancy. Get next day delivery in Ireland when you order before 2pm. Order today!,153,/belly-wraps/,,
1460,1409,C-Section Supports & Recovery,TRUE,TRUE,FALSE,TRUE,7,C Section Belly Band Delivered Direct From Ireland,50,C section belly bands help and product your cesarean section scar post pregnancy. Order yours today and get next day delivery from Ireland with An Post,151,/c-section-supports/,,
1461,1121,Bottle Feed & Accessories,TRUE,TRUE,FALSE,TRUE,16,Feeding Bottle & Bottle Accessories Direct from Ireland,55,Shop our range of feeding bottle and bottle accessories. Order before 2pm and get next day delivery with An Post on all Irish orders. Order yours today!,152,/bottle-feed-accessories/,,
1462,1121,Food Preparation & Storage,TRUE,TRUE,FALSE,TRUE,44,Baby Food Containers : Best Baby Food Prep Products,51,Shop our range of baby food prep and baby food containers. Order before 2pm and get same day dispatch from our Irish based warehouse. Order yours today!,152,/food-preparation-storage/,,
1463,1121,"Cups, Cutlery & Accessories",TRUE,TRUE,FALSE,TRUE,23,Sippy Cup and Baby Cutlery Products Direct from Ireland,55,Shop our range of sippy cup and baby cutlery products online at inhealth.ie. Get next day delivery direct from our warehouse in Ireland. Order your today,153,/cups-cutlery-accessories/,,
1466,1050,Gro Bags,TRUE,TRUE,FALSE,TRUE,25,Buy Baby Gro Bags Delivered Direct From Irish Warehouse,55,"Shop our extensive range of baby gro bags, available in three different togs level. Get next day delivery on inhealth.ie. Order your baby gro bag today!",152,/gro-bags/,,
1467,1409,Shapewear,TRUE,TRUE,FALSE,TRUE,9,Pregnancy Shapewear Delivered Direct From Ireland,49,Pregnancy Shapewear will help you feel supported and secure during and after your pregnancy. Get next day tracked delivery from Ireland. Orders your today?,155,/shapewear/,,
1469,0,DUMMY,FALSE,FALSE,TRUE,FALSE,48,,0,,0,/dummy/,,
1470,971,Eco-Home,TRUE,TRUE,TRUE,TRUE,4,Eco Home : Eco Friendly Laundry & Cleaning Products,51,Shop our range of eco friendly laundry and eco friendly cleaning products. Order today before 2pm and get next day delivery direct from our warehouse in Ireland,160,/eco-home/,,
1471,0,Baby Sleep,TRUE,TRUE,FALSE,TRUE,130,Baby Sleep : Award Winning Baby Sleep and Comfort Products,58,Shop our extension range of baby sleep products from co sleepers to baby sleeping bags & ensure your baby has the perfect sleep. Order now direct from Ireland,158,/baby-sleep/,,"cots, crib, co sleepers, positioners, sleeping bags"
1472,1034,"Baby Carriers, Slings & Wraps",TRUE,TRUE,FALSE,TRUE,16,Baby Carrier : Shop Awarding Winning Baby Slings & Baby Wraps,61,Something magical happens when you carry your baby close to you using a barrier carrier or wrap. Order your baby sling now & get next day delivery in Ireland,157,/baby-carriers-sling-wraps/,,"carrier, sling, wraps"
1473,0,DISABLE,FALSE,FALSE,FALSE,FALSE,112,,0,,0,/disable/,,
1474,966,Fertility - HOT OFFERS,TRUE,TRUE,FALSE,TRUE,15,★ BEST Buys in Fertility | inhealth.ie,38,Shop Our BEST Buys in Fertility Products Now! Best Price and Next Day Delivery Ireland. Order Online Today!,107,/fertility-hot-offers-1/,,
1475,971,Covid 19 Essentials,TRUE,TRUE,FALSE,TRUE,15,Covid 19 Essentials : Buy Sanitiser & Face Masks,48,Shop our range of Covid 19 essential hygiene and sanitation products including EU certified and approved hand sanitiser and face masks. Next day Delivery,153,/covid-19-essentials/,,"face masks, covid 19, sanitizer, sanitiser, hand rub, alcohol"
1476,1471,Bed Rails,TRUE,TRUE,FALSE,TRUE,6,Bed Rails : Wooden Bed Rails for Kids & Bed Guards,50,Shop our wide selection of wooden and foldable bed rails and bed guards for kids. Get next day delivery in Ireland with An Post on all bed rails and bed guards,159,/bed-rails/,,"Bed Rails, Bed barrier, bed guard, bedrail"
1477,1471,Mattresses,TRUE,TRUE,FALSE,TRUE,11,Cot Mattresses : Shop Our Range of Cot Bed & Crib Mattresses,60,Shop our extension range of quality affordable cot and cot bed mattresses. Order today and get next day delivery direct from our warehouse in Bray Co Wicklow,157,/mattresses/,,"cot mattress, crib mattress, cot bed"
1478,971,Dental & Oral Care,TRUE,TRUE,FALSE,TRUE,7,Teeth Whitening Products : Dental & Oral Care Products,54,Discover our range of dental and oral care products. Brighten your smile with Irish products and brands and enjoy next day delivery anywhere in Ireland.,152,/dental-oral-care/,,
1479,1042,Gift With Purchase,FALSE,FALSE,FALSE,TRUE,0,,0,,0,/gift-with-purchase/,,
1480,1394,Bathing,TRUE,TRUE,FALSE,TRUE,41,Baby Bathing : Shop Baby Baths & Baby Bathing Products,54,Discover our range of quality baby bathing products and accessories online at inhealth.ie. Order today and get next day delivery direct from Ireland,148,/baby-bathing/,,"baby bath, bathing, bath supports"
1481,1394,Changing,TRUE,TRUE,FALSE,TRUE,21,Baby Changing : Shop Our Range of Baby Changing Essentials,58,Discover our range of baby changing essentials and accessories. Order baby changing products online today with inhealth.ie and get next day delivery in Ireland,159,/baby-changing/,,"baby changing, changing mats"
1482,1394,Toilet Training,TRUE,TRUE,FALSE,TRUE,12,Toilet Training : Shop Toilet Training and Potty Products,57,"Our selection of toilet training products will make the toilet training process much easier for everyone. We stock toilet training seats, potties and steps",155,/toilet-training/,,"potties, potty, step, training seat, toilet training, toilet seats"
1483,971,Vitamins & Supplements,TRUE,TRUE,FALSE,TRUE,11,"Vitamins and Supplements for Immunity, Health and Wellbeing",59,Shop our range of expertly formulated vitamins and supplements to boost your immunity and overall health and wellbeing. Order online and get superfast delivery.,160,/vitamins-supplements/,,
