ID,Parent Id,Name,Has Page Title,Has Meta Description,Has Content,Is Visible,No. Of Products,Page Title,Page Title Length,Meta Description,Meta Description Length,URL,Meta Keywords,Search Keywords
966,0,Fertility,TRUE,TRUE,FALSE,TRUE,77,Products To Help You Conceive & Get Pregnant,44,If you are in search of products to help you conceive then Inhealth has a range of products to help you get pregnant. Order before 2pm for next day delivery,156,/trying-to-conceive/,Trying To Conceive,Trying To Conceive
970,0,Baby Safety,TRUE,TRUE,FALSE,TRUE,221,Baby & Child Safety Products From Ireland: Baby-Proof Your Home,63,Baby-proofing your home is essential if you have a baby or toddler. Inhealth offers a range of child safety products shipped from Ireland. Order now!,149,/baby-safety/,Baby Safety,Baby Safety
971,0,Health,TRUE,TRUE,FALSE,TRUE,176,Health & Personal Care Products For Men & Women From Ireland,60,Inhealth offers health & personal care products for men & women shipped directly from our Irish-based warehouse. Order before 2pm for same-day dispatch!,152,/health/,Health,Health
973,966,Fertility Monitors & Aids,TRUE,TRUE,FALSE,TRUE,11,Fertility Monitors & Aids: Products To Help You Conceive ,57,Find out when you are most fertile and have the best chance of conceiving with our range of fertility monitors and aids. Enjoy next day delivery from Ireland,157,/fertility-monitors-aids/,Fertility Monitors & Aids,Fertility Monitors & Aids
975,970,Stair Gates,TRUE,TRUE,FALSE,TRUE,71,"Baby Gates For Stairs: Shop BabyDan, Dreambaby & Much More",58,"Buy baby stair gates by top brands including BabyDan, Dreambaby & Safetots from Inhealth & get same-day dispatch when you order before 2pm. Order yours today!",158,/stair-gates/,Stair Gates,Stair Gates
976,971,Blood Pressure Monitors,TRUE,TRUE,FALSE,TRUE,8,Blood Pressure Monitors: Check Your Blood Pressure With Ease,60,"Inhealth offer an array of different blood pressure monitors that allow you to check blood pressure anytime, anywhere. Order by 2pm and get next day delivery.",158,/blood-pressure-monitors/,Blood Pressure Monitors,Blood Pressure Monitors
983,975,Retractable Safety Gates,TRUE,TRUE,FALSE,TRUE,9,Retractable Gate: Shop Retractable Safety Stair Gates,53,Retractable Stair Gates are the perfect solution if you don’t require the stair gate to be constant use. As the gate is retractable it also mean that stair gate does not have to be visible all the time,201,/retractable-safety-gates/,,
1005,971,Hair Loss,TRUE,TRUE,FALSE,TRUE,18,Hair Loss Products,18,Shop Our Hair Loss Products Now! Best Price and Next Day Delivery Ireland. Order Online Today!,94,/hair-loss/,Hair Loss,Hair Loss
1023,0,Pregnancy & New Mum,TRUE,TRUE,FALSE,TRUE,220,Pregnancy & New Mum Products: Best Maternity Products,53,Buy pregnancy & new mum products online from Inhealth & enjoy next day fully-tracked delivery via An Post when ordered before 2pm. Order yours today!,149,/pregnancy-new-mum/,Pregnancy & New Mum ,Pregnancy & New Mum 
1029,971,Pedometers,TRUE,TRUE,FALSE,FALSE,2,Pedometers : Portable Step Counter For Counting Steps,53,A pedometer is a portable device that counts each step a person takes by detecting movement. Order your pedometer today and get next day delivery in Ireland,156,/pedometers/,Pedometers,Pedometers
1031,970,Baby Proof Your Home,TRUE,TRUE,TRUE,TRUE,94,Baby Proof Your Home: Smart Solutions For Everyday Hazards ,59,Shop our ingenious collection of baby safety products to keep curious fingers safe from potential hazards in and around the home. Buy direct from Ireland today!,160,/baby-proof-your-home/,Baby Proof Your Home,Baby Proof Your Home
1034,0,Baby Essentials,TRUE,TRUE,FALSE,TRUE,348,"New-Born, Baby & Mum Essentials: Things To Buy For Baby",55,"We have all of your new-born, baby and mum essentials in one place to make your life that little bit easier. Looking for things to buy for a friend's baby?",155,/baby-essentials/,,
1038,971,Home Health Tests,TRUE,TRUE,FALSE,TRUE,12,Home Health Testing: Drug Test Kits & Alcohol Test Kits,55,"Buy home health testing kits from Inhealth, including drug & alcohol test kits & get discreet same working day dispatch when ordered by 2pm. Shop now!",150,/home-health-tests/,Home Health Tests,Home Health Tests
1042,0,SALE,TRUE,TRUE,TRUE,TRUE,103,Pregnancy & Baby Sale Event | inhealth.ie,41,Shop Our Pregnancy & Baby Fair Products Now! Best Price and Next Day Delivery Ireland. Order Online Today!,106,/pregnancy-baby-sale/,PREGNANCY & BABY SALE,PREGNANCY & BABY SALE
1045,1031,Window & Door Locks 1,FALSE,FALSE,FALSE,FALSE,0,,0,,0,/window-door-locks-1/,,
1047,0,Breastfeeding,TRUE,TRUE,FALSE,TRUE,102,Buy Breastfeeding Products Online: Best Breastfeeding Products,62,Buy breastfeeding products online from Inhealth for the best range of breast pumps from an Irish-based stockist. Order yours before 2pm for next day delivery,157,/breastfeeding/,Breastfeeding,Breastfeeding
1048,1031,Home Safety Kits,TRUE,TRUE,FALSE,TRUE,3,Home Safety Kits | inhealth.ie,30,Shop Our Home Safety Kits Products Now! Best Price and Next Day Delivery Ireland. Order Online Today!,101,/home-safety-kits/,Home Safety Kits,Home Safety Kits
1050,1471,Grobags & Sleep Accessories,TRUE,TRUE,FALSE,TRUE,52,Grobags & Sleep Accessories: Browse Night Lights & Sleepwares,61,Browse our range of cosy baby grobags and sleep accessories including night lights and comforters intended to give your little one the perfect nights sleep.,156,/grobags-sleep-accessories/,Grobags,Grobags
1054,1023,Fetal Dopplers,TRUE,TRUE,FALSE,TRUE,6,Buy Fetal Dopplers: Baby Heart Monitor To Use At Home,53,Buy a fetal doppler to listen to your baby's heartbeat. All of our stocked fetal dopplers are safe to use at home. Next day delivery direct from Ireland,152,/fetal-dopplers/,Fetal Dopplers,"Fetal Dopplers, doppler, doopler"
1059,1471,Night Lights & Sleeping Comforters,TRUE,TRUE,FALSE,TRUE,28,Night Lights and Baby Sleeping Comforters Direct from Ireland,61,Baby night lights and sleeping comforters are fantastic way to help your baby enjoy a great nights sleep. Order today and get next day delivery in Ireland,154,/night-lights-sleeping-comforters/,Night Lights & Sleeping Comforters,Night Lights & Sleeping Comforters
1060,1042,Trimester 1,TRUE,TRUE,TRUE,TRUE,22,Shop Essential Pregnancy Products For Trimester One,51,A healthy first trimester is crucial to the normal development of your baby. We have put together a list of pregnancy products that you might find useful,153,/trimester-1/,Trimester 1,Trimester 1
1065,1023,Pregnancy Support Belt,TRUE,TRUE,FALSE,TRUE,23,Pregnancy Support Belts: Shop Maternity Support Belt Products,61,Pregnancy belts are very discreet and provide a supportive lift during your pregnancy. Order before 2pm and get next day delivery in Ireland. Buy yours today!,158,/pregnancy-support-belt/,,
1066,966,Fertility Tests,TRUE,TRUE,FALSE,TRUE,4,Male & Female Fertility Tests For Couples To Check Fertility,60,Buy male & female fertility tests so that couples can check fertility in their own homes. Inhealth offers same day dispatch on orders placed before 2pm direct from our Irish-based warehouse. Order now!,201,/fertility-tests/,Fertility Tests - Male & Female,Fertility Tests - Male & Female
1081,1047,Nursing Underwear,TRUE,TRUE,FALSE,TRUE,9,Nursing Underwear: Designed To Mould To Your Changing Body,58,Our range of breasting bra's are designed to make nursing easy without sacrificing style or quality. Shop today and get next day tracked delivery in Ireland. ,158,/nursing-underwear/,Nursing Underwear,Nursing Underwear
1082,1059,Babygrows & Swaddles,TRUE,FALSE,TRUE,FALSE,0,Babygrows & Swaddles,20,,0,/babygrows-swaddles/,,
1085,1031,Blind Safety,TRUE,TRUE,FALSE,TRUE,2,Blind Cord Safety : Shop Blind Cord Safety Device Online,56,Blind cord safety is the most important child safety action to implement in the home. Shop our blind cord safety devices online today and get next day delivery,159,/blind-safety/,Blind Safety,Blind Safety
1090,1023,Pelvic Toners,TRUE,TRUE,FALSE,TRUE,17,Pelvic Toners: Kegel8 Pelvic Floor Toners,41,We offer a wide choice of pelvic toners to assist you in healthy pelvic toning during pregnancy & the post-natal period. Order before 2pm for next day delivery,159,/pelvic-toners/,Pelvic Toners,Pelvic Toners
1096,0,Wholesale,TRUE,FALSE,FALSE,FALSE,0,Wholesale,9,,0,/wholesale-1/,,
1098,1059,Baby Bedroom Lights & Accessories,TRUE,FALSE,TRUE,FALSE,3,Baby Bedroom Accessories,24,,0,/baby-bedroom-lights-accessories/,,
1102,971,Condoms & Sexual Health,TRUE,TRUE,FALSE,TRUE,29,Condoms & Sexual Health: Ensuring Ultimate Pleasure & Safety ,61,Sexual health is about ensuring pleasure & safety at all times. Protect yourself from STIs and unplanned pregnancy with our range of Durex Condoms & Accessories,160,/condoms-sexual-health/,Condoms & Sexual Health,Condoms & Sexual Health
1113,975,Stair Gate Extensions,TRUE,TRUE,FALSE,TRUE,18,Stair Gate Extensions: Shop Safety Gate Extensions Online,57,Stair Gate Extensions are a great solution to ensure that larger spaces or doorway can be well secured and baby proofed. We stock a wide variety of stair gate extension to meet all your space requirements,204,/stair-gate-extensions/,,
1114,1471,Cots & Cribs,TRUE,TRUE,FALSE,TRUE,42,"Baby Cots, Cribs & Accessories: Cots, Travel Cribs & Bedding",60,Our range of baby cots and travel cribs are sure to keep your little one cosy through the night. Browse our baby bedding and mattresses for ultimate comfort!,157,/cots-cribs/,Cots & Cribs,Cots & Cribs
1117,971,Tena (Continence Care),TRUE,TRUE,FALSE,FALSE,8,Tena (Continence Care),22,Shop Our Continence Care Products Now! Best Price and Next Day Delivery Ireland. Order Online Today!,100,/tena-continence-care/,Tena (Continence Care),Tena (Continence Care)
1118,970,Room Dividers & Configuration Gates,TRUE,TRUE,FALSE,TRUE,29,Baby Room Dividers : Shop Configuration Gates and Baby Fence,60,Baby room dividers & configuration gates are a great solution to give your baby safe & out of danger in the home. Order today & get next day delivery in Ireland,160,/room-dividers-configuration-gates/,Room Dividers & Configuration Gates,"Baby room divider, Configurable Baby Gate, Baby Fence, Baby Fence Play Area"
1120,1031,Magnetic Locks - Best Seller,FALSE,FALSE,FALSE,FALSE,1,,0,,0,/magnetic-locks-best-seller/,,
1121,1034,Feeding & Weaning,TRUE,TRUE,FALSE,TRUE,79,Baby Weaning Products: Find The Best Products For Your Baby,59,"Buy baby weaning products to make the weaning process as smooth as possible for you & baby. We stock top brands including Beaba, Dreambaby & Haakaa. Get fast-dispatch from our Irish-based warehouse!",198,/feeding-weaning/,Feeding & Weaning,Feeding & Weaning
1123,1042,Post Pregnancy,TRUE,TRUE,TRUE,TRUE,39,Post Pregnancy Products : Shop Postnatal Products Today,55,Discover our range of post pregnancy products by leading brands. Order your post natal products and get next day delivery direct from our warehouse in Ireland,158,/post-pregnancy/,Post Pregnancy,"post pregnancy product, postnatal products"
1131,1031,Edge Cushion Protectors,TRUE,TRUE,FALSE,TRUE,11,Corner Protector : Edge Protection & Table Corner Protectors,60,Baby proof your home with our range corner protector and edge protection products. Order your table corner protectors today and get next day delivery in Ireland,160,/edge-cushion-protectors/,Edge Cushion Protectors,Edge Cushion Protectors
1142,1031,Door Safety,TRUE,TRUE,FALSE,TRUE,6,Child Door Safety : Quality Baby Door Safety Products,53,Shop our range of quality certified child door safety products. Order your approved baby door safety products today and direct from our warehouse in Ireland,156,/door-safety/,Door Safety,Door Safety
1157,1047,Haakaa Breast Pumps & Accessories,TRUE,TRUE,FALSE,TRUE,29,Buy Haakaa Breast Pumps & Accessories Online From Ireland,57,Buy your Haakaa breast pump from Inhealth and get same working day dispatch from our warehouse in Ireland when you order before 2pm. Order yours now!,149,/haakaa-breast-pumps-accessories/,Haakaa Breast Pumps & Accessories,Haakaa Breast Pumps & Accessories
1159,1031,Kitchen Safety,TRUE,TRUE,FALSE,TRUE,34,Shop Our Range Baby Proof Kitchen Locks and Guards,50,"Sharp objects, toxic cleaning chemical, hot surfaces and boiling liquids make the kitchen potentially the most dangerous place for children in the home.",152,/kitchen-safety/,Kitchen Safety,Kitchen Safety
1161,1034,Car Seats & Pushchairs,TRUE,TRUE,FALSE,TRUE,10,Pushchairs & Car Seats: Travel Safe & Easy On Road Or Foot,58,Our range includes safe and reliable car seats & pushchairs from top brands suitable for newborns up to 12 years old. Order by 2pm and enjoy same day dispatch!,159,/car-seats-pushchairs/,Car Seats & Pushchairs,Car Seats & Pushchairs
1168,1031,Furniture & TV Safety Straps,TRUE,TRUE,FALSE,TRUE,4,Furniture Straps : Secure Your TV with Approved TV Straps,57,Install furniture straps and tv straps to avoid potentially lethal accidents to your child in the home. Place your order today for next day delivery in Ireland,159,/furniture-tv-safety-straps/,Furniture & TV Safety Straps,Furniture & TV Safety Straps
1170,1031,Bathroom Safety 1,FALSE,FALSE,FALSE,FALSE,1,,0,,0,/bathroom-safety-1/,,
1175,971,Nebulizers,TRUE,TRUE,FALSE,TRUE,2,Nebulizers: Shop Our Range Designed Specifically For Children,61,Our selection of nebulizers assist with a number of respiritory conditions and are compatible with a range of medicines. Order before 2pm for next day delivery! ,161,/nebulizers/,,Nebulizers 
1182,971,Cholesterol & Glucose Monitors,TRUE,TRUE,FALSE,TRUE,3,Buy Glucometer: Shop Glucose Monitors & Cholesterol Test Kits,61,A Glucose Meter and Cholesterol Test Kits measure the concentration of Glucose and Cholesterol in the blood. Our easy to use home Glucose Monitors and Cholesterols Monitors are a great health check from the comfort of your home. ,229,/cholesterol-glucose-monitors/,,
1192,966,Fertility Vitamins & Supplements,TRUE,TRUE,FALSE,TRUE,34,Fertility Vitamins & Supplements: Boost Male & Female Fertility,63,Make sure that you have the best chance of conceiving with our wide selection of fertility vitamins and supplements to boost male and female fertility,150,/boosting-vitamins-supplements/,Boosting Vitamins & Supplements,Boosting Vitamins & Supplements
1193,1023,Birth Balls,TRUE,TRUE,TRUE,TRUE,6,Birthing Ball : Medically Certified Pregnancy Ball Products,59,Shop our range of birthing ball and pregnancy balls products and enjoy same day dispatch when ordered before 2pm direct from our warehouse based in Ireland,155,/birthing-balls/,Birthing Balls,"Birthing , labour ball, pregnancy ball"
1195,1031,Window & Door Locks,TRUE,TRUE,FALSE,TRUE,5,Child Window Locks : Quality Approved Child Door Locks,54,Ensure your home is sufficiently baby proofed  with our range of quality child window locks and child door locks. Order today from our warehouse in Ireland,155,/window-door-locks/,Window & Door Locks,Window & Door Locks
1198,1047,Breast Pumps,TRUE,TRUE,TRUE,TRUE,23,Buy Breast Pumps Online: Top-Rated & Affordable Breast Pumps,60,Buy breast pumps from Inhealth & enjoy a choice of high-quality & affordable breast pumps. Order before 2pm for same working-day-dispatch from Ireland!,151,/breast-pumps/,Breast Pumps,Breast Pumps
1208,970,Playpens,TRUE,TRUE,TRUE,TRUE,16,Playpens: Peace Of Mind For Parents While Baby Plays Safely,59,Shop our selection of playpens from great brands at amazing prices. Remove the worry and rest assured your little one is playing safely at home. Buy yours today!,161,/playpens/,Playpens,Playpens
1214,970,Fire & Stove Safety Gates,TRUE,TRUE,FALSE,TRUE,20,"Fire, Hearth & Stove Safety Gates For Babies & Children",55,Keep babies & small children safe with our range of fire & stove safety gates. Order online & enjoy same-day dispatch when ordered before 2pm.,142,/fire-stove-safety-gates/,Fire & Stove Safety Gates,Fire & Stove Safety Gates
1215,1023,Maternity Vitamins & Supplements,TRUE,TRUE,FALSE,TRUE,37,Prenatal Vitamins: Maternity Vitamins & Maternity Supplements,61,Buy prenatal vitamins from Inhealth & and enjoy same say dispatch on orders placed before 2pm via An Post Track & Trace directly from our Irish-based warehouse. Order now!,171,/maternity-vitamins-supplements/,Maternity Vitamins & Supplements,Maternity Vitamins & Supplements
1216,970,Pet Gates - Extra Tall,TRUE,TRUE,FALSE,TRUE,19,"Shop Pet Gates, Dog Gates and Extra Tall Safety Gate Online",59,"Discover our exclusive range of quality Danish pet gates, dog gates and extra tall safety gates online. Order today & get next day delivery direct from Ireland",159,/pet-gates-extra-tall/,Pet Gates - Extra Tall,"Pet Gates, Dog gates"
1217,966,Pregnancy Tests,TRUE,TRUE,FALSE,TRUE,10,Pregnancy Tests: Buy Top Name Pregnancy Tests In Bulk Online,60,Buy top-rated pregnancy tests online from Inhealth - save time and purchase your pregnancy tests in bulk. All products are shipped directly from Ireland,152,/pregnancy-tests/,Pregnancy Tests,Pregnancy Tests
1219,1471,Baby Monitors & Breathing Monitors,TRUE,TRUE,FALSE,TRUE,9,Baby Monitors: Top Baby Breathing Monitors For Sale,51,Inhealth has a wide choice of breathing & baby monitors from leading brands including Anglecare & Snuza. Order now for next day delivery direct from Ireland,156,/baby-monitors-breathing-monitors/,Breathing Monitors & Baby Monitors,Breathing Monitors & Baby Monitors
1226,966,Ovulation Tests,TRUE,TRUE,FALSE,TRUE,9,"Buy Ovulation Tests: Digital Ovulation Tests Online, Ireland",60,Order ovulation tests online from Inhealth for a wide choice of digital ovulation tests & increase your chances of getting pregnant. Order before 2pm for next day delivery,171,/ovulation-tests/,Ovulation Tests,Ovulation Tests
1229,1047,Breast Pads & Breast Care,TRUE,TRUE,FALSE,TRUE,28,Breast Pads & Breast Care: Keeping You Dry And Pain Free,56,Browse our extensive range of breast pads and breast care products designed to keep you dry and pain free whilst breastfeeding. Buy now for next day delivery!,158,/breast-pads-breast-care/,,Breast Pads & Breast Care
1241,1031,Socket Covers,TRUE,TRUE,FALSE,TRUE,2,Socket Covers : Baby Proof Plug Covers for Electric Plug Sockets,64,Little fingers getting into electric plug sockets in the home can be potentially fatal. Order your socket covers today and get next day delivery in Ireland,155,/socket-covers/,Socket Covers,"socket covers, plug covers"
1252,1042,New Mum & Baby,TRUE,TRUE,TRUE,TRUE,87,Discover Our Range of Baby Products & New Mum Products,54,Discover our extensive range of quality baby products & essential products for new mums. Order today for next day delivery direct from our warehouse in Ireland,159,/new-mum-baby/,New Mum & Baby,"New Mum products,  Baby products"
1255,966,Fertility Lubricants,TRUE,TRUE,FALSE,TRUE,7,Fertility Lubricant: Preseed & Sasmar Fertility Lubricants,58,Give yourselves the best chance of getting pregnant with our fertility lubricants by leading brands including Preseed & Sasmar. Next day delivery from Ireland,158,/fertility-lubricants/,Fertility Lubricants,Fertility Lubricants
1256,970,Extra Tall Room Dividers and Safety Gates,TRUE,TRUE,TRUE,TRUE,4,Extra Tall Room Dividers : Buy Extra Tall Baby Gates Online ,60,Discover our exculsive range of Danish made extra tall room dividers and extra tall baby gates. Order today and get next day delivery direct from Ireland,153,/extra-tall-room-dividers-and-safety-gates/,Extra Tall Room Dividers and Safety Gates,Extra Tall Room Dividers and Safety Gates
1259,971,Foot Care,TRUE,TRUE,FALSE,FALSE,19,Foot Care | inhealth.ie,23,Shop Our Foot Care Products Now! Best Price and Next Day Delivery Ireland. Order Online Today!,94,/foot-care/,Foot Care,Foot Care
1263,1047,Ardo Spares Parts & Accessories,TRUE,TRUE,FALSE,TRUE,16,Ardo Spares Parts & Accessories: Shop Our Range Of Ardo parts,61,"Shop our wide selection of Ardo spares, parts & accessories. From nipple shields to breast shells, Inhealth have you covered with next day delivery from Ireland!",161,/ardo-spares-parts-accessories/,Ardo Spares Parts & Accessories,Ardo Spares Parts & Accessories
1273,1047,Milk Storage and Supply,TRUE,TRUE,FALSE,TRUE,11,Milk Storage And Supply: Keep Milk Fresh For Your Little One ,61,Shop our wide range of storage solutions to keep milk fresh and our supply supplements to keep supply at a premium. Order before 2pm and get same day dispatch!,159,/milk-storage-and-supply/,Milk Storage and Supply,Milk Storage and Supply
1276,966,★ Fertility - HOT OFFERS,TRUE,TRUE,FALSE,FALSE,0,★ BEST Buys in Fertility | inhealth.ie,38,Shop Our BEST Buys in Fertility Products Now! Best Price and Next Day Delivery Ireland. Order Online Today!,107,/fertility-hot-offers/,BEST Buys in Fertility , BEST Buys in Fertility 
1284,1042,Trimester 3,TRUE,TRUE,TRUE,TRUE,50,Shop Essential Pregnancy Products For Trimester Three,53,As the trimester three progresses and your baby continues to grow it is time to start preparing. Order your labour essential and new born baby products today,157,/trimester-3/,Trimester 3,Trimester 3
1289,975,Pressure Fitting - No Screws,TRUE,TRUE,FALSE,TRUE,35,Pressure Fit Stair Gate: Shop Stair Gates No Screws,51,"A Pressure Fitting Stair Gate is a Baby Safety Gate that does no require any screws, the main benefit of Pressure is that no drilling into walls is required. This type of gate is also very easy to move to a different location in the house",238,/pressure-fitting-no-screws/,,
1298,1471,Baby Sleep Positioners & Accessories,TRUE,TRUE,FALSE,TRUE,19,Baby Sleep Positioners & Accessories: Helping Baby To Sleep ,60,Comfortable sleep positioners and cosy sleeping accessories for your little one to drift off like a dream. Shop our range and get next day delivery from Ireland!,161,/baby-sleep-positioners-accessories/,Baby Sleep Positioners & Accessories,Baby Sleep Positioners & Accessories
1299,1034,Baby Health & Toiletries,TRUE,TRUE,FALSE,TRUE,85,Baby Care : Newborn Baby Care Products & Baby Toiletries Set,60,Shop our fantastic range of baby care products including newborn baby care and toiletries sets. Order today and get next day delivery in Ireland,144,/baby-health/,,Baby Health
1300,1031,Oven Safety,FALSE,FALSE,FALSE,FALSE,0,,0,,0,/oven-safety/,,
1303,1042,Trimester 2,TRUE,TRUE,TRUE,TRUE,40,Shop Essential Pregnancy Products For Trimester Two,51,Trimester two often brings a welcome relief from early pregnancy symptoms. The team at inhealth have put together a list of relevant pregnancy products,151,/trimester-2/,Trimester 2,Trimester 2
1310,1031,Bedroom Safety,TRUE,TRUE,FALSE,TRUE,19,Bedroom Safety | inhealth.ie,28,Shop Our Bedroom Safety Products Now! Best Price and Next Day Delivery Ireland. Order Online Today!,99,/bedroom-safety/,Bedroom Safety,Bedroom Safety
1312,1031,Bathroom Safety,TRUE,TRUE,FALSE,TRUE,23,Bathroom Safety | inhealth.ie,29,Shop Our Bathroom Safety Products Now! Best Price and Next Day Delivery Ireland. Order Online Today!,100,/bathroom-safety/,Bathroom Safety,Bathroom Safety
1317,971,Weight Management,TRUE,TRUE,FALSE,TRUE,25,Weight Management: Long-Term Solutions To Manage Your Weight,60,Browse our tasty range of simple weight management products that are long term solutions to achieve a healthier lifestyle. Order by 2pm for next day delivery! ,159,/weight-management/,Weight Management,Weight Management
1332,1034,Thermometers,TRUE,TRUE,FALSE,TRUE,9,Thermometer : Best Baby Thermometer and Digital Thermometer,59,Shop our range of approved medically certified digitial baby thermometers. Order your thermometer today and get next day delivery from our warehouse in Ireland,159,/thermometers-2/,Thermometers,Thermometers
1333,970,Must Have Baby & Toddler Safety Essentials,TRUE,TRUE,FALSE,TRUE,32,Must Have Baby & Toddler Safety Essentials | inhealth.ie,56,Shop Our Must Have Baby & Toddler Safety Essentials Products Now! Best Price and Next Day Delivery Ireland. Order Online Today!,127,/must-have-baby-toddler-safety-essentials/,Must Have Baby & Toddler Safety Essentials,Must Have Baby & Toddler Safety Essentials
1338,1023,Tens Machines - Maternity,TRUE,TRUE,FALSE,TRUE,4,Tens Machines : Maternity Ten Unit For Natural Pain Relief,58,Tens Machines will give you natural pain relief during labour and are an essential part of your hospital bag. Order today and get next day delivery in Ireland,158,/tens-machines-maternity/,Tens Machines - Maternity,"Tens Machines, tens unit, Transcutaneous electrical nerve stimulation"
1340,1034,Beaba Babycook & Storage,TRUE,TRUE,FALSE,TRUE,39,Beaba Babycook & Storage: Prepare Baby Food Quick And Easy,58,Prepare all kinds of different food for your little one quickly and easily with our range of Beaba Babycook products & accessories. Buy  directly from Ireland!,159,/beaba-babycook-storage/,Beaba Babycook & Storage,Beaba Babycook & Storage
1345,1034,Humidifiers,TRUE,TRUE,FALSE,TRUE,6,Humidifier : Shop Humidifier For Children's Room Online,55,Shop our range of quality humidifier brands suitable for infants and young children. Order today and get next day delivery from our warehouse in Ireland,152,/humidifiers-vaporizers/,Humidifiers & Vaporizers,Humidifiers & Vaporizers
1361,1023,Pregnancy Pillows & Supports,TRUE,TRUE,FALSE,TRUE,22,Pregnancy Pillows: Body & Sleeping Maternity Support Pillows,60,"Buy pregnancy pillows & supports from Inhealth, we offer a variety of U & V-shaped pregnancy pillows for sleeping and for the whole body. Next day delivery",155,/pregnancy-pillows-supports/,Pregnancy Pillows & Supports,Pregnancy Pillows & Supports
1364,1023,Stretch Marks & Maternity Skincare,TRUE,TRUE,FALSE,TRUE,55,Stretch Marks & Maternity Skincare: Looking After Your Skin,59,Hormonal shifts throughout pregnancy can have a visible effect on the tone & texture of your skin. Shop our range of stretch mark & maternity skincare products,159,/stretch-marks-maternity-skincare/,,Stretch Marks & Maternity Skincare
